{
  "id": "00000000-0000-4000-8000-000000000002",
  "name": "fixture-agent",
  "control_online": false,
  "private_data_reachable": null,
  "business_healthy": null,
  "last_seen": 1735689600100,
  "revoked_at": null,
  "agent_version": null,
  "connection_kind": "ssh",
  "terminal_available": true,
  "ssh_status": "unknown",
  "ssh_checked_at": null
}
